{
  "$schema": "http://json-schema.org/draft-07/schema#",
  "$id": "urn:archsift:ruleset:v1",
  "type": "object",
  "additionalProperties": false,
  "properties": {
    "schemaVersion": {
      "const": 1
    },
    "id": {
      "type": "string",
      "minLength": 1
    },
    "version": {
      "type": "string",
      "minLength": 1
    },
    "description": {
      "type": "string"
    },
    "rules": {
      "type": "array",
      "items": {
        "$ref": "#/definitions/rule"
      },
      "minItems": 1
    },
    "exceptions": {
      "type": "array",
      "items": {
        "$ref": "#/definitions/exception"
      },
      "minItems": 0
    }
  },
  "required": [
    "schemaVersion",
    "id",
    "version",
    "description",
    "rules",
    "exceptions"
  ],
  "definitions": {
    "selector": {
      "type": "object",
      "additionalProperties": false,
      "properties": {
        "kind": {
          "enum": [
            "project",
            "assembly",
            "namespace",
            "type",
            "source-file"
          ]
        },
        "match": {
          "enum": [
            "exact",
            "glob"
          ]
        },
        "value": {
          "type": "string",
          "minLength": 1
        },
        "allowEmpty": {
          "type": "boolean"
        }
      },
      "required": [
        "kind",
        "match",
        "value"
      ]
    },
    "projectSelector": {
      "allOf": [
        {
          "$ref": "#/definitions/selector"
        },
        {
          "type": "object",
          "additionalProperties": false,
          "properties": {
            "kind": {
              "const": "project"
            },
            "match": {
              "enum": [
                "exact",
                "glob"
              ]
            },
            "value": {
              "type": "string",
              "minLength": 1
            },
            "allowEmpty": {
              "type": "boolean"
            }
          },
          "required": [
            "kind",
            "match",
            "value"
          ]
        }
      ]
    },
    "typeSelector": {
      "allOf": [
        {
          "$ref": "#/definitions/selector"
        },
        {
          "properties": {
            "kind": {
              "enum": [
                "type",
                "namespace"
              ]
            }
          }
        }
      ]
    },
    "rule": {
      "oneOf": [
        {
          "type": "object",
          "additionalProperties": false,
          "properties": {
            "id": {
              "type": "string",
              "minLength": 1
            },
            "type": {
              "const": "project-reference"
            },
            "enabled": {
              "type": "boolean"
            },
            "scope": {
              "$ref": "#/definitions/selector"
            },
            "parameters": {
              "type": "object",
              "additionalProperties": false,
              "properties": {
                "source": {
                  "$ref": "#/definitions/projectSelector"
                },
                "target": {
                  "$ref": "#/definitions/projectSelector"
                }
              },
              "required": [
                "source",
                "target"
              ]
            },
            "severity": {
              "enum": [
                "info",
                "warning",
                "error"
              ]
            },
            "reason": {
              "type": "string",
              "minLength": 1
            }
          },
          "required": [
            "id",
            "type",
            "enabled",
            "scope",
            "parameters",
            "severity",
            "reason"
          ]
        },
        {
          "type": "object",
          "additionalProperties": false,
          "properties": {
            "id": {
              "type": "string",
              "minLength": 1
            },
            "type": {
              "const": "graph-integrity"
            },
            "enabled": {
              "type": "boolean"
            },
            "scope": {
              "$ref": "#/definitions/selector"
            },
            "parameters": {
              "type": "object",
              "additionalProperties": false,
              "properties": {
                "check": {
                  "enum": [
                    "resolved-references",
                    "solution-membership"
                  ]
                }
              },
              "required": [
                "check"
              ]
            },
            "severity": {
              "enum": [
                "info",
                "warning",
                "error"
              ]
            },
            "reason": {
              "type": "string",
              "minLength": 1
            }
          },
          "required": [
            "id",
            "type",
            "enabled",
            "scope",
            "parameters",
            "severity",
            "reason"
          ]
        },
        {
          "type": "object",
          "additionalProperties": false,
          "properties": {
            "id": {
              "type": "string",
              "minLength": 1
            },
            "type": {
              "const": "target-framework"
            },
            "enabled": {
              "type": "boolean"
            },
            "scope": {
              "$ref": "#/definitions/selector"
            },
            "parameters": {
              "type": "object",
              "additionalProperties": false,
              "properties": {
                "allowedFrameworks": {
                  "type": "array",
                  "items": {
                    "enum": [
                      "net8.0",
                      "net9.0",
                      "net10.0"
                    ]
                  },
                  "minItems": 1
                }
              },
              "required": [
                "allowedFrameworks"
              ]
            },
            "severity": {
              "enum": [
                "info",
                "warning",
                "error"
              ]
            },
            "reason": {
              "type": "string",
              "minLength": 1
            }
          },
          "required": [
            "id",
            "type",
            "enabled",
            "scope",
            "parameters",
            "severity",
            "reason"
          ]
        },
        {
          "type": "object",
          "additionalProperties": false,
          "properties": {
            "id": {
              "type": "string",
              "minLength": 1
            },
            "type": {
              "const": "nuget-denylist"
            },
            "enabled": {
              "type": "boolean"
            },
            "scope": {
              "$ref": "#/definitions/selector"
            },
            "parameters": {
              "type": "object",
              "additionalProperties": false,
              "properties": {
                "forbiddenPackageIds": {
                  "type": "array",
                  "items": {
                    "type": "string",
                    "minLength": 1
                  },
                  "minItems": 1
                }
              },
              "required": [
                "forbiddenPackageIds"
              ]
            },
            "severity": {
              "enum": [
                "info",
                "warning",
                "error"
              ]
            },
            "reason": {
              "type": "string",
              "minLength": 1
            }
          },
          "required": [
            "id",
            "type",
            "enabled",
            "scope",
            "parameters",
            "severity",
            "reason"
          ]
        },
        {
          "type": "object",
          "additionalProperties": false,
          "properties": {
            "id": {
              "type": "string",
              "minLength": 1
            },
            "type": {
              "const": "type-dependency"
            },
            "enabled": {
              "type": "boolean"
            },
            "scope": {
              "$ref": "#/definitions/selector"
            },
            "parameters": {
              "type": "object",
              "additionalProperties": false,
              "properties": {
                "source": {
                  "$ref": "#/definitions/typeSelector"
                },
                "forbiddenTarget": {
                  "$ref": "#/definitions/typeSelector"
                }
              },
              "required": [
                "source",
                "forbiddenTarget"
              ]
            },
            "severity": {
              "enum": [
                "info",
                "warning",
                "error"
              ]
            },
            "reason": {
              "type": "string",
              "minLength": 1
            }
          },
          "required": [
            "id",
            "type",
            "enabled",
            "scope",
            "parameters",
            "severity",
            "reason"
          ]
        },
        {
          "type": "object",
          "additionalProperties": false,
          "properties": {
            "id": {
              "type": "string",
              "minLength": 1
            },
            "type": {
              "const": "naming"
            },
            "enabled": {
              "type": "boolean"
            },
            "scope": {
              "$ref": "#/definitions/selector"
            },
            "parameters": {
              "type": "object",
              "additionalProperties": false,
              "properties": {
                "subjectKind": {
                  "enum": [
                    "project",
                    "assembly",
                    "type",
                    "source-file"
                  ]
                },
                "requiredName": {
                  "type": "object",
                  "additionalProperties": false,
                  "properties": {
                    "match": {
                      "enum": [
                        "exact",
                        "glob"
                      ]
                    },
                    "value": {
                      "type": "string",
                      "minLength": 1
                    }
                  },
                  "required": [
                    "match",
                    "value"
                  ]
                }
              },
              "required": [
                "subjectKind",
                "requiredName"
              ]
            },
            "severity": {
              "enum": [
                "info",
                "warning",
                "error"
              ]
            },
            "reason": {
              "type": "string",
              "minLength": 1
            }
          },
          "required": [
            "id",
            "type",
            "enabled",
            "scope",
            "parameters",
            "severity",
            "reason"
          ]
        }
      ]
    },
    "exception": {
      "type": "object",
      "additionalProperties": false,
      "properties": {
        "id": {
          "type": "string",
          "minLength": 1
        },
        "ruleId": {
          "type": "string",
          "minLength": 1
        },
        "scope": {
          "$ref": "#/definitions/selector"
        },
        "reason": {
          "type": "string",
          "minLength": 1
        }
      },
      "required": [
        "id",
        "ruleId",
        "scope",
        "reason"
      ]
    }
  }
}
