{
  "schemaVersion": 1,
  "id": "template-type-dependency",
  "version": "1.0.0",
  "description": "type-dependency template. Review selectors and policy reasons before use.",
  "rules": [
    {
      "id": "type-dependency-01",
      "type": "type-dependency",
      "enabled": true,
      "scope": {
        "kind": "namespace",
        "match": "glob",
        "value": "*"
      },
      "parameters": {
        "source": {
          "kind": "namespace",
          "match": "glob",
          "value": "Sample.Domain*"
        },
        "forbiddenTarget": {
          "kind": "namespace",
          "match": "glob",
          "value": "Sample.Infrastructure*"
        }
      },
      "severity": "warning",
      "reason": "Describe the intended architecture policy."
    }
  ],
  "exceptions": []
}
